<!DOCTYPE college [
<!ELEMENT college (teacher)>
<!ELEMENT teacher (name,class,subject)>
<!ELEMENT name (#PCDATA)>
<!ELEMENT class (#PCDATA)>
<!ELEMENT subject (#PCDATA)>
]>